{
  "schema_version": "x.grok.adaptive_recall_wave.effective_prompt_policy.v1",
  "binding_version": "adaptive-effective-prompt-entry-semantics-v1",
  "policy_id": "adaptive_base_discovery_effective_prompts.v1",
  "owner": "x_first_adaptive_wave_operator",
  "allowed_discovery_dimensions": [
    "target_lab_affiliation",
    "professional_role_or_function",
    "public_research_evidence",
    "pretraining_relevance"
  ],
  "entries": [
    {
      "policy_entry_id": "synthetic_lab_base_model_training_contract_fixture.v1",
      "target": {
        "lab_id": "synthetic_lab",
        "research_focus_id": "base_model_training",
        "scope": "Public professional evidence for a synthetic lab-neutral fixture."
      },
      "source_prompt_sha256": "1583b055b0156e02ddbfc0a33b4f36ab46d560d89c8d7919c772877aba173cae",
      "authority": "fixture_only"
    },
    {
      "policy_entry_id": "openai_pretraining_recall_wave1.v1",
      "target": {
        "lab_id": "openai",
        "research_focus_id": "pretraining",
        "scope": "Public professional evidence of current or historical OpenAI affiliation and current or historical pre-training or base-model training relevance."
      },
      "source_prompt_sha256": "c18b45a88367eb51e81c3c279c80a1d89893b79d2d34b292eb0f0d95d8d13c99",
      "authority": "live_authorized"
    },
    {
      "policy_entry_id": "openai_pretraining_recall_wave2.v1",
      "target": {
        "lab_id": "openai",
        "research_focus_id": "pretraining",
        "scope": "Public professional evidence of current or historical OpenAI affiliation and current or historical pre-training or base-model training relevance."
      },
      "source_prompt_sha256": "b5c8aeeed181d29bd85d38348b1fa77df8c4074f3b2f253b8cfbc781d6b17456",
      "authority": "live_authorized"
    },
    {
      "policy_entry_id": "openai_pretraining_recall_wave3.v1",
      "target": {
        "lab_id": "openai",
        "research_focus_id": "pretraining",
        "scope": "Public professional evidence of current or historical OpenAI affiliation and current or historical pre-training or base-model training relevance."
      },
      "source_prompt_sha256": "0173b80e9bc88a16f7c378681533f04c07f117f4f6c0b11fcda5a9021ab699f7",
      "authority": "live_authorized"
    },
    {
      "policy_entry_id": "openai_pretraining_recall_wave4.v1",
      "target": {
        "lab_id": "openai",
        "research_focus_id": "pretraining",
        "scope": "Public professional evidence of current or historical OpenAI affiliation and current or historical pre-training or base-model training relevance."
      },
      "source_prompt_sha256": "fc8d4bc1ee59a8a992b06d3def988abed6981597c795a37c3930360d18761fc5",
      "authority": "live_authorized"
    },
    {
      "policy_entry_id": "openai_pretraining_recall_wave5.v1",
      "target": {
        "lab_id": "openai",
        "research_focus_id": "pretraining",
        "scope": "Public professional evidence of current or historical OpenAI affiliation and current or historical pre-training or base-model training relevance."
      },
      "source_prompt_sha256": "c02f036e93e0815da056ae29b69b2eb81e4bd3a18376a7e477aa508aea69ada0",
      "authority": "live_authorized"
    },
    {
      "policy_entry_id": "openai_pretraining_recall_wave6.v1",
      "target": {
        "lab_id": "openai",
        "research_focus_id": "pretraining",
        "scope": "Public professional evidence of current or historical OpenAI affiliation and current or historical pre-training or base-model training relevance."
      },
      "source_prompt_sha256": "b950501b3034cf57e7e2b5a2429253a824ae23985d6a6edd12e1a9ba6294fca6",
      "authority": "live_authorized"
    },
    {
      "policy_entry_id": "openai_pretraining_recall_wave7.v1",
      "target": {
        "lab_id": "openai",
        "research_focus_id": "pretraining",
        "scope": "Public professional evidence of current or historical OpenAI affiliation and current or historical pre-training or base-model training relevance."
      },
      "source_prompt_sha256": "2db5049f74f8c9d57b8c5be2232df88a10e8dbb5902adf017ced987fbfe73c76",
      "authority": "live_authorized"
    },
    {
      "policy_entry_id": "google_deepmind_pretraining_recall_wave1.v1",
      "target": {
        "lab_id": "google_deepmind",
        "research_focus_id": "pretraining",
        "scope": "Public professional evidence of current or historical Google DeepMind affiliation and current or historical pre-training or base-model training relevance."
      },
      "source_prompt_sha256": "b8073ded1675dbb96801caa36247f8cbe152d921b02dd7a18a2824cb4099d544",
      "authority": "live_authorized"
    },
    {
      "policy_entry_id": "google_deepmind_pretraining_recall_wave2.v1",
      "target": {
        "lab_id": "google_deepmind",
        "research_focus_id": "pretraining",
        "scope": "Public professional evidence of current or historical Google DeepMind affiliation and current or historical pre-training or base-model training relevance."
      },
      "source_prompt_sha256": "a195728be9c6ed239d3e9912417513634c31d8ab5b01d635f541622f40cfd677",
      "authority": "live_authorized"
    },
    {
      "policy_entry_id": "google_deepmind_pretraining_recall_wave2_discovery_first.v2",
      "target": {
        "lab_id": "google_deepmind",
        "research_focus_id": "pretraining",
        "scope": "Public professional evidence of current or historical Google DeepMind affiliation and current or historical pre-training or base-model training relevance."
      },
      "source_prompt_sha256": "b8f7a6e4a47b850d12a8756141fcab9d060f11c03a749d95e389fbcb94432f52",
      "authority": "live_authorized"
    },
    {
      "policy_entry_id": "google_deepmind_pretraining_recall_wave2_discovery_first_post_reply.v3",
      "target": {
        "lab_id": "google_deepmind",
        "research_focus_id": "pretraining",
        "scope": "Public professional evidence of current or historical Google DeepMind affiliation and current or historical pre-training or base-model training relevance."
      },
      "source_prompt_sha256": "8b752a8dd6606ac609f47fa5ce14af7c4c7518dffa2f302ca5292e46f1180651",
      "authority": "live_authorized"
    },
    {
      "policy_entry_id": "google_deepmind_pretraining_recall_wave3.v1",
      "target": {
        "lab_id": "google_deepmind",
        "research_focus_id": "pretraining",
        "scope": "Public professional evidence of current or historical Google DeepMind affiliation and current or historical pre-training or base-model training relevance."
      },
      "source_prompt_sha256": "0ff2d205592dccebdd2a5ccaccf73296bc7702cc299c46d1020ed07b18a22ab9",
      "authority": "live_authorized"
    }
  ]
}
